Release Date,Season,Episode,Episode Title,Name,Sentence
2012-04-08,Season 2,Episode 2,The Night Lands,tyrion lannister,I appreciate your loyalty. Tell me.
2012-04-08,Season 2,Episode 2,The Night Lands,janos,I did. And I would again. The man was a traitor. He tried to buy my loyalty.
2012-04-08,Season 2,Episode 2,The Night Lands,tyrion lannister,The fool! He had no idea you were already bought.
2012-04-08,Season 2,Episode 2,The Night Lands,janos,Are you drunk? I'll not have my honor questioned by an Imp.
2012-04-08,Season 2,Episode 2,The Night Lands,tyrion lannister,"I'm not questioning your honor, Lord Janos. I'm denying its existence."
2012-04-08,Season 2,Episode 2,The Night Lands,janos,"You think I'll stand here and take this from you, dwarf."
2012-04-08,Season 2,Episode 2,The Night Lands,tyrion lannister,"Dwarf? You should have stopped at imp. And yes, you will stand here and take it from me, unless you'd like to take it from my friend here."
2012-04-08,Season 2,Episode 2,The Night Lands,tyrion lannister,"I intend to serve as Hand of the King until my father returns from the war, and seeing as you betrayed the last Hand of the King, well, I just wouldn't feel safe with you lurking about."
2012-04-08,Season 2,Episode 2,The Night Lands,janos,What are you ta- My friends at court will not allow this. The queen herself -
2012-04-08,Season 2,Episode 2,The Night Lands,tyrion lannister,The queen regent. And you're a fool to believe she's your friend.
2012-04-08,Season 2,Episode 2,The Night Lands,janos,We shall hear what Joffrey has to say about this.
2012-04-08,Season 2,Episode 2,The Night Lands,tyrion lannister,"No, we shan't."
2012-04-08,Season 2,Episode 2,The Night Lands,tyrion lannister,"There's a ship leaving for East Watch by the sea tonight. From there, I'm afraid it's rather a long walk to Castle Black. I hope you enjoy the Wall. I found it surprisingly beautiful, in a brutal, horribly uncomfortable sort of way."
2012-04-08,Season 2,Episode 2,The Night Lands,bronn,"The lads will escort you. The streets aren't safe at night, my lord."
2012-04-08,Season 2,Episode 2,The Night Lands,janos,These men are under my command. . I command you to arrest this cutthroat.
2012-04-08,Season 2,Episode 2,The Night Lands,tyrion lannister,His name is Bronn... and he is the new commander of the City Watch.
2012-04-08,Season 2,Episode 2,The Night Lands,bronn,Boys?
2012-04-08,Season 2,Episode 2,The Night Lands,janos,I have friends at court! Powerful friends! The king himself made me a lord!
2012-04-08,Season 2,Episode 2,The Night Lands,tyrion lannister,To the new Commander.
2012-04-08,Season 2,Episode 2,The Night Lands,tyrion lannister,"If I told you to murder, an infant girl say, still at her mother's breast, would you do it without question?"
2012-04-08,Season 2,Episode 2,The Night Lands,bronn,Without question? No. I'd ask how much.
2012-04-08,Season 2,Episode 2,The Night Lands,lommy,"If they come back, I say we yield. Gendry's the one they want. I don't want to get caught in the middle of a battle."
2012-04-08,Season 2,Episode 2,The Night Lands,hot pie,I'm not afraid of no battles.
2012-04-08,Season 2,Episode 2,The Night Lands,arya stark,"If you got within a mile of a battle, you'd fill your pants."
2012-04-08,Season 2,Episode 2,The Night Lands,hot pie,I've seen lots of battles. I saw -
2012-04-08,Season 2,Episode 2,The Night Lands,arya stark,Liar.
2012-04-08,Season 2,Episode 2,The Night Lands,hot pie,I saw a man kill another man just outside a tavern in Flea Bottom. Stabbed him right in the neck.
2012-04-08,Season 2,Episode 2,The Night Lands,lommy,Two men fighting isn't a battle.
2012-04-08,Season 2,Episode 2,The Night Lands,hot pie,They had armor on.
2012-04-08,Season 2,Episode 2,The Night Lands,arya stark,So?
2012-04-08,Season 2,Episode 2,The Night Lands,hot pie,"So, if they got armor on, it's a battle."
2012-04-08,Season 2,Episode 2,The Night Lands,lommy,"No, it isn't."
2012-04-08,Season 2,Episode 2,The Night Lands,hot pie,What's a dyer's apprentice know about battles anyway?
2012-04-08,Season 2,Episode 2,The Night Lands,arya stark,"Gendry's an armorer's apprentice. Hot Pie, tell Gendry what makes it a battle."
2012-04-08,Season 2,Episode 2,The Night Lands,hot pie,It's when they've got armor on.
2012-04-08,Season 2,Episode 2,The Night Lands,gendry baratheon,Now who told you that.
2012-04-08,Season 2,Episode 2,The Night Lands,hot pie,A knight?
2012-04-08,Season 2,Episode 2,The Night Lands,gendry baratheon,How'd you know he was a knight?
2012-04-08,Season 2,Episode 2,The Night Lands,hot pie,"Well, cause he got armor on."
2012-04-08,Season 2,Episode 2,The Night Lands,gendry baratheon,You don't have to be a knight to have armor. Any idiot can buy armor. .
2012-04-08,Season 2,Episode 2,The Night Lands,hot pie,How'd you know?
2012-04-08,Season 2,Episode 2,The Night Lands,gendry baratheon,Cause I sold armor.
2012-04-08,Season 2,Episode 2,The Night Lands,arya stark,What do the gold cloaks want with you?
2012-04-08,Season 2,Episode 2,The Night Lands,gendry baratheon,No idea.
2012-04-08,Season 2,Episode 2,The Night Lands,arya stark,You're a liar.
2012-04-08,Season 2,Episode 2,The Night Lands,gendry baratheon,You shouldn't insult people that are bigger than you.
2012-04-08,Season 2,Episode 2,The Night Lands,arya stark,Then I wouldn't get to insult anyone. .
2012-04-08,Season 2,Episode 2,The Night Lands,gendry baratheon,"Well, I don't care what any of them want. No goodo s ever come of their questions."
2012-04-08,Season 2,Episode 2,The Night Lands,arya stark,No goodo s ever come? Who asked questions before?
2012-04-08,Season 2,Episode 2,The Night Lands,gendry baratheon,How can someone so small be such a huge pain in my ass?
2012-04-08,Season 2,Episode 2,The Night Lands,arya stark,Who asked questions?
2012-04-08,Season 2,Episode 2,The Night Lands,gendry baratheon,"The Hand of the King. Er, hands of the King. Lord Arryn came first, a few weeks before he died. And then Lord Stark came, a few weeks before he died."
2012-04-08,Season 2,Episode 2,The Night Lands,arya stark,Lord Stark.
2012-04-08,Season 2,Episode 2,The Night Lands,gendry baratheon,See? Asking me questions is bad luck. . You'll probably be dead soon.
2012-04-08,Season 2,Episode 2,The Night Lands,arya stark,What did they ask about?
2012-04-08,Season 2,Episode 2,The Night Lands,gendry baratheon,My mom.
2012-04-08,Season 2,Episode 2,The Night Lands,arya stark,Who's your mom?
2012-04-08,Season 2,Episode 2,The Night Lands,gendry baratheon,Just my mom. Worked in a tavern. Died when I was little.
2012-04-08,Season 2,Episode 2,The Night Lands,arya stark,And who was your father?
2012-04-08,Season 2,Episode 2,The Night Lands,gendry baratheon,"He could be one of those gold-hatted bastards, for all I know. What about you, anyway? You thought they were after you, why? Did you kill someone, or is it just because you're a girl?"
2012-04-08,Season 2,Episode 2,The Night Lands,arya stark,I'm not a girl!
2012-04-08,Season 2,Episode 2,The Night Lands,gendry baratheon,Yes you are. You think I'm as stupid as the rest of them?
2012-04-08,Season 2,Episode 2,The Night Lands,arya stark,"Stupider. Night's Watch doesn't take girls, everyone knows that."
2012-04-08,Season 2,Episode 2,The Night Lands,gendry baratheon,That's true. You're still a girl.
2012-04-08,Season 2,Episode 2,The Night Lands,arya stark,I am not!
2012-04-08,Season 2,Episode 2,The Night Lands,gendry baratheon,"Well, pull your cock out and take a piss then."
2012-04-08,Season 2,Episode 2,The Night Lands,arya stark,I don't need to take a piss… Lommy and Hot Pie can't know. No one can know.
2012-04-08,Season 2,Episode 2,The Night Lands,gendry baratheon,They won't. Not from me.
2012-04-08,Season 2,Episode 2,The Night Lands,arya stark,My name's not Arry. It's Arya. Of House Stark. Yoren is taking me home to Winterfell.
2012-04-08,Season 2,Episode 2,The Night Lands,gendry baratheon,He was your father. The Hand. The traitor.
2012-04-08,Season 2,Episode 2,The Night Lands,arya stark,He was never a traitor! Joffrey is a liar.
2012-04-08,Season 2,Episode 2,The Night Lands,gendry baratheon,"So you're a highborn, then. You're a lady."
2012-04-08,Season 2,Episode 2,The Night Lands,arya stark,"No. I mean yes. My mother was a lady, and my sister -"
2012-04-08,Season 2,Episode 2,The Night Lands,gendry baratheon,"You were a lordo s daughter and you lived in a castle. Look, all that about cocks. I should never have said that. I've been pissing in front of you and everything. I should be calling you milady."
2012-04-08,Season 2,Episode 2,The Night Lands,arya stark,Do not call me milady.
2012-04-08,Season 2,Episode 2,The Night Lands,gendry baratheon,"As milady commands. . Well, that was unladylike."
2012-04-08,Season 2,Episode 2,The Night Lands,man,What you carrying?
2012-04-08,Season 2,Episode 2,The Night Lands,theon greyjoy,Pears and oranges. Wine from the Arbor. And the heir to Pyke of the Iron Islands. . The only living son of Balon Greyjoy. . Me.
2012-04-08,Season 2,Episode 2,The Night Lands,man,Don't like wine. Woman's drink. .
2012-04-08,Season 2,Episode 2,The Night Lands,theon greyjoy,I need to get to Pyke.
2012-04-08,Season 2,Episode 2,The Night Lands,man,I'll find you a horse.
2012-04-08,Season 2,Episode 2,The Night Lands,yara greyjoy,I'm heading that way. I can take you there.
2012-04-08,Season 2,Episode 2,The Night Lands,theon greyjoy,I bet you can.
2012-04-08,Season 2,Episode 2,The Night Lands,yara greyjoy,You been at sea long? Or were there just no women where you came from?
2012-04-08,Season 2,Episode 2,The Night Lands,theon greyjoy,None like you.
2012-04-08,Season 2,Episode 2,The Night Lands,yara greyjoy,You don't know what I'm like.
2012-04-08,Season 2,Episode 2,The Night Lands,theon greyjoy,You don't know what you're like. You need someone to teach you. Know who I am?
2012-04-08,Season 2,Episode 2,The Night Lands,yara greyjoy,You think I offer free rides to every man in jewelry. Lord Greyjoy.
2012-04-08,Season 2,Episode 2,The Night Lands,theon greyjoy,Have my things sent up to the castle.
2012-04-08,Season 2,Episode 2,The Night Lands,theon greyjoy,"You should give me the reins, I'm a better rider than you. I've been on horseback for the last nine years."
2012-04-08,Season 2,Episode 2,The Night Lands,yara greyjoy,Nine years. Do you still know your way around a ship? Have these hands ever touched a rope?
2012-04-08,Season 2,Episode 2,The Night Lands,theon greyjoy,Don't you worry about my hands. . The sea's in my blood.
2012-04-08,Season 2,Episode 2,The Night Lands,yara greyjoy,Your blood will be in the sea if I don't watch where I'm going.
2012-04-08,Season 2,Episode 2,The Night Lands,theon greyjoy,"I have a proposal for my father. One that will make him king again. And me after him. You may stay at the castle tonight, if you're lucky."
2012-04-08,Season 2,Episode 2,The Night Lands,yara greyjoy,Is that an offer from my future king?
2012-04-08,Season 2,Episode 2,The Night Lands,theon greyjoy,"An order, from your future king. You can tell your grandchildren about this night."
2012-04-08,Season 2,Episode 2,The Night Lands,yara greyjoy,I don't imagine it will be a story fit for children.
2012-04-08,Season 2,Episode 2,The Night Lands,theon greyjoy,Father.
2012-04-08,Season 2,Episode 2,The Night Lands,balon,"Nine years, is it? They took a frightened boy. What have they given back?"
2012-04-08,Season 2,Episode 2,The Night Lands,theon greyjoy,A man. Your blood and your heir.
2012-04-08,Season 2,Episode 2,The Night Lands,balon,We shall see. Stark had you longer than I did.
2012-04-08,Season 2,Episode 2,The Night Lands,theon greyjoy,Lord Stark is gone.
2012-04-08,Season 2,Episode 2,The Night Lands,balon,And how do you feel about that?
2012-04-08,Season 2,Episode 2,The Night Lands,theon greyjoy,What's done is done. I've brought you a proposal from Robb Stark.
2012-04-08,Season 2,Episode 2,The Night Lands,balon,Who gave you those clothes? . Was it Ned Stark's pleasure to make you his daughter?
2012-04-08,Season 2,Episode 2,The Night Lands,theon greyjoy,"If my clothes offend you, I will change them."
2012-04-08,Season 2,Episode 2,The Night Lands,balon,It will. . That bauble around your neck. Did you pay the iron price for it or the gold? . I asked a question. Did you pull it from the neck of a corpse you made or did you buy it to match your fine clothes? Iron or gold?
2012-04-08,Season 2,Episode 2,The Night Lands,theon greyjoy,Gold.
2012-04-08,Season 2,Episode 2,The Night Lands,balon,I'll not have my son dressed as a whore. . My fears have come true. The Starks have made you theirs.
2012-04-08,Season 2,Episode 2,The Night Lands,theon greyjoy,My blood is salt and iron.
2012-04-08,Season 2,Episode 2,The Night Lands,balon,"Yet, , the Stark boy sends you to me like a trained raven, clutching his message."
2012-04-08,Season 2,Episode 2,The Night Lands,theon greyjoy,"The offer he makes, is one I proposed."
2012-04-08,Season 2,Episode 2,The Night Lands,balon,He heeds your counsel?
2012-04-08,Season 2,Episode 2,The Night Lands,theon greyjoy,"I've lived with him, hunted with him, fought at his side, he thinks of me as a brother."
2012-04-08,Season 2,Episode 2,The Night Lands,balon,"No, not here, , not in my hearing, you will not name him brother. This son of the man who put your true brothers to the sword. Or have you forgotten your own blood?"
2012-04-08,Season 2,Episode 2,The Night Lands,theon greyjoy,I forget nothing. I remember my brothers. And I remember when my father was a king.
2012-04-08,Season 2,Episode 2,The Night Lands,balon,I see. I destroy Robb Stark's enemies for him and he will make me King of the Iron Islands once again.
2012-04-08,Season 2,Episode 2,The Night Lands,theon greyjoy,I will lead the attack myself.
2012-04-08,Season 2,Episode 2,The Night Lands,balon,"Oh, you will?"
2012-04-08,Season 2,Episode 2,The Night Lands,theon greyjoy,I'm your son. Your only living heir. Who else?
2012-04-08,Season 2,Episode 2,The Night Lands,theon greyjoy,I told you to wait outside. . How did you get past the guards?
2012-04-08,Season 2,Episode 2,The Night Lands,yara greyjoy,Anything with a cock is easy to fool.
2012-04-08,Season 2,Episode 2,The Night Lands,balon,My dear.
2012-04-08,Season 2,Episode 2,The Night Lands,theon greyjoy,Yara?
2012-04-08,Season 2,Episode 2,The Night Lands,yara greyjoy,"So good to see you, brother. This is a homecoming I'll tell my grandchildren about."
2012-04-08,Season 2,Episode 2,The Night Lands,theon greyjoy,She can't lead an attack!
2012-04-08,Season 2,Episode 2,The Night Lands,balon,And why not?
2012-04-08,Season 2,Episode 2,The Night Lands,theon greyjoy,You're a woman!
2012-04-08,Season 2,Episode 2,The Night Lands,yara greyjoy,You're the one in skirts.
2012-04-08,Season 2,Episode 2,The Night Lands,balon,"This isn't Winterfell, boy. Your sister took over command of your eldest brother's ship after your new father killed him."
2012-04-08,Season 2,Episode 2,The Night Lands,all three,What's dead may never die.
2012-04-08,Season 2,Episode 2,The Night Lands,balon,No man gives me a crown. I pay the iron price. I will take my crown. . That is who I am. That is who we have always been.
2012-04-08,Season 2,Episode 2,The Night Lands,theon greyjoy,You won't stand a chance against the Lannisters on your own.
2012-04-08,Season 2,Episode 2,The Night Lands,balon,Who said anything about the Lannisters?
2012-04-08,Season 2,Episode 2,The Night Lands,davos,You'll have your gold when we take the treasury at King's Landing.
2012-04-08,Season 2,Episode 2,The Night Lands,saan,"All these kings fighting for the throne, and this Stannis has the smallest army. Why would I bet on the man with the worst chance?"
2012-04-08,Season 2,Episode 2,The Night Lands,davos,"Because you're a smart gambler. Stannis has proved himself in war. Twice. His baby brother has never set foot on a battlefield. Neither has the false king, Joffrey."
2012-04-08,Season 2,Episode 2,The Night Lands,saan,"And yet, they both have larger armies."
2012-04-08,Season 2,Episode 2,The Night Lands,davos,Stannis has just begun the fight. His bannermen will rally to his cause. There's no man in the Seven Kingdoms more honorable than Stannis Baratheon. Or more worthy of loyalty.
2012-04-08,Season 2,Episode 2,The Night Lands,saan,What is the world coming to when smugglers must vouch for the honor of kings.
2012-04-08,Season 2,Episode 2,The Night Lands,matthos,"Mind your words, pirate. ."
2012-04-08,Season 2,Episode 2,The Night Lands,davos,Matthos.
2012-04-08,Season 2,Episode 2,The Night Lands,saan,You think I'm insulted? I am a pirate. I'm an excellent pirate. I don't sail for promises.
2012-04-08,Season 2,Episode 2,The Night Lands,davos,"Of course you do. Every time you leave harbor, you're leaving on a promise. A promise that somewhere on the seas, somebody's got some gold and you can take it from them."
2012-04-08,Season 2,Episode 2,The Night Lands,saan,That's a promise that always comes true.
2012-04-08,Season 2,Episode 2,The Night Lands,davos,"As is mine. You're not the young man, Salladhor. And correct me if I'm wrong"
2012-04-08,Season 2,Episode 2,The Night Lands,saan,Only the clever ones.
2012-04-08,Season 2,Episode 2,The Night Lands,davos,"You want to spend your last few years on the sea, stealing from Pentoshi cheesemongers and Midanese silk merchants, then go. They're out there waiting for you. That's easy. What I'm offering you is hard. Come with me and plunder the greatest city in Westeros. You'll be the richest man in Lysene. And the most famous. They'll be singing songs about you as long as men have voices to sing."
2012-04-08,Season 2,Episode 2,The Night Lands,saan,Salladhor Saan is a good name for songs.
2012-04-08,Season 2,Episode 2,The Night Lands,davos,It is. .
2012-04-08,Season 2,Episode 2,The Night Lands,saan,"One thing, I want the queen."
2012-04-08,Season 2,Episode 2,The Night Lands,davos,The queen?
2012-04-08,Season 2,Episode 2,The Night Lands,saan,"Cersei, I want her. I'll sail with your fleet, all 30 of my ships, and if we don't drown at the bottom of Blackwater Bay, I will fuck this blonde queen and I will fuck her well."
2012-04-08,Season 2,Episode 2,The Night Lands,matthos,This war isn't about you. We're not attacking King's Landing so that you can rape the queen.
2012-04-08,Season 2,Episode 2,The Night Lands,saan,"I'm not going to rape her, I'm going to fuck her."
2012-04-08,Season 2,Episode 2,The Night Lands,matthos,As if she would just let you!
2012-04-08,Season 2,Episode 2,The Night Lands,saan,You don't know how persuasive I am. I never tried to fuck you.
2012-04-08,Season 2,Episode 2,The Night Lands,matthos,"Stannis is the rightful king, and the Lord of Light. The one true god."
2012-04-08,Season 2,Episode 2,The Night Lands,saan,"I've been all over the world, my boy, and everywhere I go, people tell me about the true god. They all think they found the right one. The one true god is what's between a woman's legs, and better yet a queen's legs."
2012-04-08,Season 2,Episode 2,The Night Lands,saan,I never thought you'd have a true believer for a son.
2012-04-08,Season 2,Episode 2,The Night Lands,davos,He's young yet. I promise you the gold. I promise you the glory. I cannot promise you the queen.
2012-04-08,Season 2,Episode 2,The Night Lands,matthos,You believe your king can win?
2012-04-08,Season 2,Episode 2,The Night Lands,davos,He is the one true king.
2012-04-08,Season 2,Episode 2,The Night Lands,saan,"You Westerosee are funny people. A man chops off your fingers and you fall in love with him. . I'll sail with you, Davos Seaworth. You are the most honest smuggler I ever met. Make me rich."
2012-04-08,Season 2,Episode 2,The Night Lands,davos,Get me to the gates of King's Landing and I will.
2012-04-08,Season 2,Episode 2,The Night Lands,matthos,When will the King have a sail?
2012-04-08,Season 2,Episode 2,The Night Lands,davos,As soon as his God wills it.
2012-04-08,Season 2,Episode 2,The Night Lands,matthos,"He's my God too, and yours. But you were too blind to see. . Let me teach you how to read."
2012-04-08,Season 2,Episode 2,The Night Lands,davos,Oh you and your mother.
2012-04-08,Season 2,Episode 2,The Night Lands,matthos,It won't take long. You already know the letters. The holy books are much more persuasive than I can be.
2012-04-08,Season 2,Episode 2,The Night Lands,davos,"I wish I had a God, truly! I'm not mocking you, but I've seen men pray to every God there is. Pray for wind, pray for rain, pray for home. None of it works!"
2012-04-08,Season 2,Episode 2,The Night Lands,matthos,But you always came home.
2012-04-08,Season 2,Episode 2,The Night Lands,davos,I wasn't praying.
2012-04-08,Season 2,Episode 2,The Night Lands,matthos,"But I was. Every night that you were at sea, I lit a candle and I prayed, for you."
2012-04-08,Season 2,Episode 2,The Night Lands,davos,"You want me to have a god, fine. King Stannis is my god. He raised me up and blessed me with his trust. He gave you a future I could never have imagined. You know how to read, you'll be a knight someday. You think your fire god commanded all that? It was Stannis. Only Stannis."
2012-04-08,Season 2,Episode 2,The Night Lands,matthos,"Stannis is my king, but he's only a man."
2012-04-08,Season 2,Episode 2,The Night Lands,davos,Don't tell him that.
2012-04-08,Season 2,Episode 2,The Night Lands,cersei lannister,Lord Janos Slynt was Commander of the City Watch. You had no right to exile him.
2012-04-08,Season 2,Episode 2,The Night Lands,tyrion lannister,I have every right. I am the King's Hand.
2012-04-08,Season 2,Episode 2,The Night Lands,cersei lannister,You're serving as the King's Hand until father gets here. I am Queen Regent.
2012-04-08,Season 2,Episode 2,The Night Lands,tyrion lannister,"Listen to me, Queen Regent, you're losing the people. Do you hear me?"
2012-04-08,Season 2,Episode 2,The Night Lands,cersei lannister,"Ha, the people. You think I care?"
2012-04-08,Season 2,Episode 2,The Night Lands,tyrion lannister,"You might find it difficult to rule over millions who want you dead. Half the city will starve when winter comes. The other half will plot to overthrow you. And your gold-plated thugs just gave them the rallying cry, “The Queen slaughters babies.” . You don't even have the decency to deny it."
2012-04-08,Season 2,Episode 2,The Night Lands,tyrion lannister,"It wasn't you who gave the order, was it? Joffrey didn't even tell you. Or did he tell you? I imagine that would be even worse."
2012-04-08,Season 2,Episode 2,The Night Lands,cersei lannister,"He did what needed to be done. . You want to be the Hand of the King? You want to rule? This is what ruling is! Lying on a bed of weeds, ripping them out by the root one by one before they strangle you in your sleep."
2012-04-08,Season 2,Episode 2,The Night Lands,tyrion lannister,"I'm no king, but I think there's more to ruling that that."
2012-04-08,Season 2,Episode 2,The Night Lands,cersei lannister,"I don't care what you think! You've never taken it seriously. You haven't, Jaime hasn't. . It's all fallen on me."
2012-04-08,Season 2,Episode 2,The Night Lands,tyrion lannister,"As has Jaime repeatedly, according to Stannis Baratheon."
2012-04-08,Season 2,Episode 2,The Night Lands,cersei lannister,"You're funny. . You've always been funny. But none of your jokes will ever match the first one, will they? You remember... back when you ripped my mother open on your way out of her and she bled to death."
2012-04-08,Season 2,Episode 2,The Night Lands,tyrion lannister,She was my mother too.
2012-04-08,Season 2,Episode 2,The Night Lands,cersei lannister,"Now they're gone, for the sake of you. There's no bigger joke in the world than that. ."
2012-04-08,Season 2,Episode 2,The Night Lands,davos,Your Grace.
2012-04-08,Season 2,Episode 2,The Night Lands,matthos,Your Grace.
2012-04-08,Season 2,Episode 2,The Night Lands,stannis baratheon,How did it fare with your pirate?
2012-04-08,Season 2,Episode 2,The Night Lands,davos,Salladhor Saan will join our fleet. 30 ships. His men know how to fight.
2012-04-08,Season 2,Episode 2,The Night Lands,stannis baratheon,"In my experience, pirates prefer fighting unarmed men."
2012-04-08,Season 2,Episode 2,The Night Lands,davos,Does seem the wiser choice.
2012-04-08,Season 2,Episode 2,The Night Lands,stannis baratheon,It won't be a choice this time. Do you trust him?
2012-04-08,Season 2,Episode 2,The Night Lands,davos,"Salladhor Saan is an old friend, I've known him 30 years. I've never trusted him."
2012-04-08,Season 2,Episode 2,The Night Lands,stannis baratheon,"Well if he does his job, he'll have his share. Leave us."
2012-04-08,Season 2,Episode 2,The Night Lands,davos,"At once, Your Grace."
2012-04-08,Season 2,Episode 2,The Night Lands,melisandre,"The Lord of Light shines through you, young warrior."
2012-04-08,Season 2,Episode 2,The Night Lands,davos,Come.
2012-04-08,Season 2,Episode 2,The Night Lands,stannis baratheon,What did you say to him?
2012-04-08,Season 2,Episode 2,The Night Lands,melisandre,I told him death by fire is the purest death.
2012-04-08,Season 2,Episode 2,The Night Lands,stannis baratheon,Why?
2012-04-08,Season 2,Episode 2,The Night Lands,melisandre,Because it is true. You're troubled my king.
2012-04-08,Season 2,Episode 2,The Night Lands,stannis baratheon,Yeah.
2012-04-08,Season 2,Episode 2,The Night Lands,melisandre,These armies are but toys for the Lord of Light.
2012-04-08,Season 2,Episode 2,The Night Lands,stannis baratheon,Tell your lord to burn them then.
2012-04-08,Season 2,Episode 2,The Night Lands,melisandre,I tell him nothing! I pray for his commands and I obey.
2012-04-08,Season 2,Episode 2,The Night Lands,stannis baratheon,My little brother has a hundred thousand men according to the scouts. Men whose allegiance rightly belongs to me.
2012-04-08,Season 2,Episode 2,The Night Lands,melisandre,You must have faith.
2012-04-08,Season 2,Episode 2,The Night Lands,stannis baratheon,"Faith? In a real war, the side with the greater number wins nine times out of ten."
